{
  "schemaVersion": 1,
  "name": "pstack",
  "displayName": "pstack for MiniMax Code",
  "version": "0.15.36-minimax.1",
  "description": "An independent MiniMax Code port of pstack: rigorous investigation, design, implementation and evidence-driven verification.",
  "author": "Lauren Tan (upstream pstack); mcode-pstack contributors (MiniMax Code adapter)",
  "icon": "icon.png",
  "category": "Code",
  "exampleQueries": [
    "/pstack:poteto-mode この不具合を調査し、テストで確認して修正してください",
    "/pstack:arena 複数の設計案を独立に比較してください",
    "/pstack:setup-pstack モデルの継承と役割別設定を確認したい"
  ],
  "apps": [],
  "mcpServers": [],
  "skills": [
    "skills/architect/SKILL.md",
    "skills/arena/SKILL.md",
    "skills/automate-me/SKILL.md",
    "skills/benchmark-checklist/SKILL.md",
    "skills/blast-radius/SKILL.md",
    "skills/bro/SKILL.md",
    "skills/correct/SKILL.md",
    "skills/create-formal-verification-skill/SKILL.md",
    "skills/create-verification-skill/SKILL.md",
    "skills/figure-it-out/SKILL.md",
    "skills/how/SKILL.md",
    "skills/in-your-own-words/SKILL.md",
    "skills/interrogate/SKILL.md",
    "skills/ketchup-video/SKILL.md",
    "skills/ketchup/SKILL.md",
    "skills/maintain-formal-verification-skill/SKILL.md",
    "skills/maintain-verification-skill/SKILL.md",
    "skills/make-bot-ui/SKILL.md",
    "skills/no-comments/SKILL.md",
    "skills/poteto-help/SKILL.md",
    "skills/poteto-mode/SKILL.md",
    "skills/principle-attack-the-premise/SKILL.md",
    "skills/principle-boundary-discipline/SKILL.md",
    "skills/principle-build-the-lever/SKILL.md",
    "skills/principle-encode-lessons-in-structure/SKILL.md",
    "skills/principle-exhaust-the-design-space/SKILL.md",
    "skills/principle-experience-first/SKILL.md",
    "skills/principle-explain-the-number/SKILL.md",
    "skills/principle-fix-root-causes/SKILL.md",
    "skills/principle-foundational-thinking/SKILL.md",
    "skills/principle-guard-the-context-window/SKILL.md",
    "skills/principle-laziness-protocol/SKILL.md",
    "skills/principle-make-operations-idempotent/SKILL.md",
    "skills/principle-migrate-callers-then-delete-legacy-apis/SKILL.md",
    "skills/principle-minimize-reader-load/SKILL.md",
    "skills/principle-model-the-domain/SKILL.md",
    "skills/principle-never-block-on-the-human/SKILL.md",
    "skills/principle-outcome-oriented-execution/SKILL.md",
    "skills/principle-prove-it-works/SKILL.md",
    "skills/principle-redesign-from-first-principles/SKILL.md",
    "skills/principle-separate-before-serializing-shared-state/SKILL.md",
    "skills/principle-sequence-verifiable-units/SKILL.md",
    "skills/principle-subtract-before-you-add/SKILL.md",
    "skills/principle-test-behavior-not-implementation/SKILL.md",
    "skills/principle-type-system-discipline/SKILL.md",
    "skills/recall/SKILL.md",
    "skills/reflect/SKILL.md",
    "skills/setup-pstack/SKILL.md",
    "skills/sharpen/SKILL.md",
    "skills/show-me-your-work/SKILL.md",
    "skills/statechart/SKILL.md",
    "skills/swarm/SKILL.md",
    "skills/tdd/SKILL.md",
    "skills/teach/SKILL.md",
    "skills/technical-writing/SKILL.md",
    "skills/typescript-best-practices/SKILL.md",
    "skills/unslop/SKILL.md",
    "skills/why/SKILL.md"
  ]
}
